[
  {
    "karar_no": 1,
    "sayfa_no": 1,
    "sira_no": "1",
    "mahkeme": "Hukuk Genel Kurulu",
    "esas_no": "2017/1672",
    "karar_no_": "2019/502",
    "tarih": "30.04.2019",
    "karar_metni": "1 Hukuk Genel Kurulu 2017/1672 2019/502 30.04.2019\n\n3 Hukuk Genel Kurulu 2012/842 2013/291 27.02.2012\n\n10 Hukuk Genel Kurulu 2012/1086 2013/294 27.02.2013\n5,264,\n\nHukuk Genel Kurulu         2017/1672 E.  ,  2019/502 K.\n\"İçtihat Metni\"\nMAHKEMESİ :İcra Hukuk MahkemesiTaraflar arasındaki “istihkak iddiası\" talebinden dolayı yapılan inceleme sonunda Bursa 6. İcra (Hukuk) Mahkemesince konusu kalmayan dava hakkında karar verilmesine yer olmadığına ve haczedilen menkullerin değerinin %40'ı oranında tazminatın davalı alacaklıdan alınarak, davacı üçüncü kişiye verilmesine dair verilen 30.07.2013 tarihli ve 2012/568 E., 2013/557 K. sayılı karar, davalı alacaklı vekilinin ve katılma yoluyla davacı üçüncü kişi vekilinin ayrı ayrı temyiz istemleri üzerine Yargıtay 8. Hukuk Dairesinin 20.02.2014 tarihli ve 2013/20302 E., 2014/2863 K. sayılı kararı ile;\n\"...Davacı üçüncü kişi vekili, Bursa 8. İcra Müdürlüğü’nün 2012/7286 sayılı Takip dosyasında yazılan talimat uyarınca, Bakırköy 3. İcra Müdürlüğü’nün 2012/696 sayılı Talimat dosyasında Bursa 1. Asliye Ticaret Mahkemesi’nin 28.05.2012 gün, 2012/1766 Değişik İş sayılı ihtiyati haciz kararı uyarınca yapılan 31.05.2012 günlü hacze konu menkullerin davacı üçüncü kişiye ait olduğunu, haciz adresinin ve mahcuzların borçlu ile ilgisinin bulunmadığını, alacaklının haczi kötü niyetli olarak yaptırdığını, davacı ve borçlu şirketler arasında organik bağ da bulunmadığını, borçlunun sadece davacının 28.02.2012’den beri distribütörlüğünü yaptığı Thomas firmasının 21.02.2012’ye kadar distribütörlüğünü yapan bir firma olduğunu belirterek istihkak iddiasının kabulü ile haczin kaldırılmasına ve tazminata karar verilmesini istemiştir.\nDavalı alacaklı vekili, dava konusu haczin talimat adresinde geçen yerde yapıldığını, bu sırada borçluya ait belgelerin bulunduğunu, istihkak iddiasını kanıtlamaya elverişli delillerin sunulamadığını, faturaların bir kısmının borcun doğum tarihinden kısa süre önce, bir kısmının ise daha sonra düzenlendiğini, mahcuzların misli mal olması nedeni ile faturalar ile karşılaştırılmasının da mümkün bulunmadığını, davacının 21.02.2012’den sonra borçlunun Thomas firmasının distribütörlüğünü yapmadığını beyan etmesine rağmen resmi kayıtlarda 13.01.2011’den beri yaptığının belirlendiğini, alacaklıdan mal kaçırmak için danışıklı işlemler yapıldığını belirterek davanın reddine ve tazminata karar verilmesi gerektiğini savunmuştur.\nMahkemece toplanan delillere göre: dava konusu haczin dayanağı olan Bursa 1. Asliye Ticaret Mahkemesi’ne ait 2012/1766 Değişik İş sayılı kararın, Bursa 4. Asliye Ticaret Mahkemesi’nin ihtiyati haciz kararının 2013/663 Değişik İş sayılı dosyasında verilen 17.07.2013 tarihli kararla kaldırıldığı, böylece hacizlerin düştüğünün kabulü gerektiği, geçerli bir haczin bulunmasının dava şartı olup yargılamanın her aşamasında dikkate alınması gerektiği, davanın konusuz kaldığı, yargılama giderleri ile nispi vekalet ücretinin davanın açılmasına neden olan tarafa yükletilmesi gerektiği, davalı alacaklının haczin kaldırılmasını istemediği için davanın açılmasına neden olan taraf olarak kabulü gerektiği, diğer yandan teminat karşılığında takip durduğundan kötü niyet tazminatına da hükmedilmesi gerektiği gerekçesi ile davanın konusu kalmadığından karar verilmesine yer olmadığına karar verilmiş; hüküm, davalı alacaklı vekili ve katılma yolu ile davacı üçüncü kişi vekili tarafından temyiz edilmiştir.\n1.Dava, üçüncü kişi tarafından İİK’nun 96. vd. maddeleri uyarınca açtığı “istihkak” davası niteliğindedir.\nDava konusu haciz, Bursa 1. Asliye Ticaret Mahkemesi’nin 28.05.2012 gün, 2012/1766 Değişik İş sayılı ihtiyati haciz kararı uyarınca İİK’nun 261/1. maddesindeki 10 günlük yasal süresi içinde yapılmış, aynı Kanun’un 264/1. maddesindeki 7 günlük yasal hak düşürücü süre içinde de asıl takibe geçilmiş, böylece haciz kesinleşmiştir. Sonradan yapılan itiraz üzerine ihtiyati haciz kararının kaldırılması kesinleşen hacze etki etmeyecektir.\nMahkemece işin esasına girilerek taraflarca sunulan delillerin toplanmasından sonra bir karar verilmesi gerekirken, davanın konusuz kalması nedeni ile karar verilmesine yer olmadığına yönelik yazılı biçimde hüküm kurulması isabetli olmamıştır.\n2.Bozma neden ve şekline göre diğer temyiz itirazlarının bu aşamada incelenmesi gerekli görülmemiştir...\"\ngerekçesiyle bozularak dosya yerine geri çevrilmekle, yeniden yapılan yargılama sonunda, mahkemece önceki kararda direnilmiştir.HUKUK GENEL KURULU KARARI\nHukuk Genel Kurulunca incelenerek direnme kararının süresinde temyiz edildiği anlaşıldıktan ve direnme kararının verildiği tarih itibariyle 1086 sayılı Hukuk Usulü Muhakemeleri Kanunu’nun 2494 sayılı Kanun ile değişik 438. maddesi gereğince direnme kararlarının temyiz incelemesinde duruşma yapılamayacağından duruşma isteğinin reddine karar verilip dosyadaki belgeler okunduktan sonra gereği görüşüldü:\nDava, istihkak iddiasına ilişkindir.\nDavacı-üçüncü kişi vekili; Bursa 8. İcra Müdürlüğünün 2012/7286 E. sayılı takip dosyasında yazılan talimat uyarınca, Bakırköy 3. İcra Müdürlüğünün 2012/696 sayılı Talimat dosyasında Bursa 1. Asliye Ticaret Mahkemesi’nin 28.05.2012 tarihli, 2012/1766 D.İş sayılı ihtiyati haciz kararı uyarınca yapılan 31.05.2012 tarihli hacze konu menkullerin borçlu Sanikom Uluslararası Pazarlama A.Ş.'ne değil müvekkiline ait olduğunu, haciz yapılan adresin ve mahcuzların borçlu şirket ile ilgisinin bulunmadığını, borçlu şirket ile müvekkili arasında organik bağ da bulunmadığını, tamamen zarar verme kastı ile müvekkilinin adresinde haciz yapabilmek için ihtiyati haciz kararının yetkisiz mahkemeden alındığını, alacaklının haciz işlemini kötü niyetli olarak yaptırdığını ileri sürerek istihkak iddiasının kabulü ile alacaklı aleyhine %40 kötü niyet tazminatına hükmedilmesini talep etmiştir.\nDavalı-alacaklı vekili; dava konusu haciz işleminin talimat adresinde geçen yerde yapıldığını, haciz sırasında bulunan borçluya ait belgelerin davacı ile aralarında organik bağ olduğunu gösterdiğini, davacının sunduğu delillerin her zaman düzenlenebilecek muvazaalı belgeler olup istihkak iddiasını kanıtlamaya elverişli deliller olmadığını belirterek davanın reddine ve davacı üçüncü kişi aleyhine %40 kötü niyet tazminatına hükmedilmesini savunmuştur.\nYerel Mahkemece; Bursa 1. Asliye Ticaret Mahkemesinin 2012/1766 D. İş sayılı ihtiyati haciz kararı, Bursa 4. Asliye Ticaret Mahkemesinin 2013/663 D. İş sayılı ilamı ile 17.07.2013 tarihinde kaldırıldığından istihkak iddiasına konu talimat icra dairesi ile yapılan hacizlerin düştüğü, yargılamanın her safhasında geçerli haczin bulunması gerektiği, ihtiyati haciz kararının kaldırılmasıyla geçerli haciz bulunmadığından açılan davanın konusunun kalmadığı, delillerin toplanma aşamasından sonra dava konusuz kaldığından yargılama giderleri ile vekâlet ücretinin tam olarak hesaplanması ve haczedilen menkullerin değeri takip miktarından daha az takdir edildiğinden haczedilen menkullerin değeri üzerinden vekalet ücretinin taktiri gerektiği, bunun yanında davanın açılması ile birlikte davacı tarafından yatırılan teminat mukabili takibin tedbiren durdurulmasına karar verildiğinden ve davanın açılmasına davalı alacaklı sebebiyet verdiğinden ihtiyati haciz kararı kaldırılana kadar ki geçen safhada davalı alacaklının hacizlerden vazgeçildiğine dair beyanı da bulunmadığı gerekçesiyle konusu kalmayan dava hakkında karar verilmesine yer olmadığına, İİK'nun 97. maddesinin 13. fıkrası uyarınca davalı alacaklının haczedilen menkul malların değeri olan 33.500,00TL'nin %40'ı oranında 13.400,00TL kötü niyet tazminatına mahkûm edilmesine, davacı taraf kendisini vekil ile temsil ettirdiğinden karar tarihinde yürürlükte bulunan Avukatlık Asgari Ücret Tarifesine göre belirlenen 3.935,00TL nispi vekâlet ücretinin davalı taraftan alınarak davacı tarafa verilmesine ve yargılama giderlerinin davalı taraftan alınarak davacı tarafa verilmesine karar verilmiştir.\nDavalı alacaklı vekilinin ve katılma yoluyla davacı üçüncü kişi vekilinin temyiz itirazları üzerine Özel Dairece yukarıda başlık bölümünde gösterilen nedenlerle yerel mahkeme kararı bozulmuştur.\nYerel Mahkemece önceki gerekçeye ek olarak; her ne kadar Yargıtay 8. Hukuk Dairesi'nce İİK'nın 261. maddesinin 1. fıkrasında 10 günlük yasal süre içinde takibe geçilmiş olması nedeniyle haczin kesinleştiği kabul edilmiş ise de İİK'nın 265. maddesinin 2. fıkrası gereğince istihkak iddia eden davacı üçüncü kişinin ihtiyati hacze maruz kaldığı tarih itibari ile süresi içinde 01.06.2012 hâkim havalesi ile Bursa 1. Asliye Ticaret Mahkemesine yetki ve esas yönünden yaptığı itirazın, ihtiyati haczin davacı üçüncü kişi açısından kesinleşmesini önlediği, ihtiyati haciz kararının esastan kaldırılmasına karar verildiğinden alacaklı tarafından takip borçlusu aleyhine ihtiyati haciz kararı ile birlikte yasal sürede takibe geçmiş olmasının ihtiyati haczin davacı üçüncü kişi yönünden kesinleşmesi sonucunu doğurmayacağı gerekçesiyle direnme kararı verilmiştir.\nDirenme kararı davalı alacaklı vekili tarafından temyize getirilmektedir.\nDirenme yoluyla Hukuk Genel Kurulu önüne gelen uyuşmazlık; ihtiyati haciz kararının kaldırılmasının, istihkak iddiasına konu hacze etki edip etmeyeceği, burada varılacak sonuca göre istihkak iddiasının esasının incelenip incelenemeyeceği noktasında toplanmaktadır.\nHaczedilen bir mal üzerinde, (alacaklı ve borçlu dışındaki) bir üçüncü kişinin, mülkiyet veya rehin hakkı gibi bir hak sahibi olduğunun ileri sürülmesine, istihkak denir. 2004 sayılı İcra ve İflas Kanununda (İİK) hacizden doğan istihkak davası (m. 96-99) ve iflastan doğan istihkak davası (m. 228) olarak ayrı ayrı düzenlenmiştir.\nİİK'nun 96. maddesi “Borçlu, elinde bulunan bir malı başkasının mülkü veya rehni olarak gösterdiği yahut üçüncü bir şahıs tarafından o mal üzerinde mülkiyet veya rehin hakkı iddia edildiği takdirde, icra dairesi bunu haciz ve icra tutanaklarına geçirir ve keyfiyeti iki tarafa bildirir.\nİcra dairesi aynı zamanda istihkak iddiasına karşı itirazları olup olmadığını bildirmek üzere alacaklı ve borçluya üç günlük mühlet verir. Sukütları hâlinde istihkak iddiasını kabul etmiş sayılırlar.\nMalın haczine muttali olan borçlu veya üçüncü şahıs, ıttıla tarihinden itibaren yedi gün içinde istihkak iddiasında bulunmadığı takdirde, aynı takipte bu iddiayı ileri sürmek hakkını kaybeder. İstihkak iddiasının yapıldığı veya istihkak davasının açıldığı tarihte istihkak müddeisi ile birlikte oturan kimseler yahut bu şahısların iş ortakları, iddianın yapıldığı tarihte veya istihkak davası 97 nci maddenin 9 uncu fıkrası gereğince açılmışsa davanın açıldığı tarihte malın haczine ıttıla kesbetmiş sayılırlar.” hükmünü içermektedir.\nMadde metninden de açıkça anlaşılacağı gibi, istihkak iddiasının dinlenebilmesi için öncelikle, usulüne uygun yapılmış bir icra takibinin ve haciz işleminin bulunması gerekmektedir. İstihkak davası devam ederken, dava konusu mal üzerindeki haciz kalkarsa, istihkak davası konusuz kalır. Bu hâlde, icra mahkemesinin dava hakkında karar verilmesine yer olmadığına karar vermesi gerekir (Kuru, B. İcra ve İflas Hukuku 1990 İstanbul, C 2, s. 1103). Davanın açıldığı tarih itibariyle geçerli bir haciz yoksa dava şartı bulunmadığından davanın reddine karar verilmesi gerekir.\nKanun haczin varlığını öngörmüş, ancak bu haczin kesin haciz olmasını aramamıştır. O hâlde istihkak davasına (m. 97) veya istihkak iddiasının reddi davasına (m. 99) kesin haciz (m.78/1) konu olabileceği gibi, geçici haciz (m. 69/1) ilave haciz (m. 100/ sondan 2. f.), tamamlama haczi (m. 139) veya ihtiyati haciz (m. 261/2) de konu olabilir (T., Muşul: İstihkak Davaları, Ankara 2015, s. 21).\nİhtiyati haciz alacaklının devam etmekte olan veya henüz başlamamış olan bir takibin veya davanın sonunda alacağın ödenmesini garanti altına almak için borçlunun mallarına (önceden) geçici olarak el konulmasıdır (Arslan, R./Yılmaz, E./Ayvaz ,S.,T.: İcra ve İflas Hukuku, Ankara 2007, s. 422) .\nİİK'nın 261. maddesinin 2. fıkrasında \"ihtiyati haciz kararları 79 dan 99 uncuya kadar olan maddelerdeki haczin ne surette yapılacağına dair hükümlere göre icra edilir\" şeklinde düzenleme yer aldığından istihkak prosedürünün ihtiyati hacizlerde de uygulanabileceği anlaşılmaktadır. İhtiyati haciz esnasında açılan istihkak davasının görülebilmesi için ihtiyati haczin, dava açılırken ve dava süresince geçerli olarak devam etmesi gerekir. Yani İİK'nın 264. maddesine göre ihtiyati haczin hükümsüz kalmaması, İİK'nın 265. maddesine göre ihtiyati hacze itirazın mahkemece reddedilmesi gerekir. İhtiyati haciz kararına itiraz ve temyiz başlıklı İİK'nın 265. maddesinin 1. fıkrası borçlunun ihtiyati haciz kararına itirazını düzenlemiştir. Borçlunun ihtiyati haciz kararına itirazı üzerine ihtiyati haciz kararı kaldırılır ise buna dayalı olarak yapılan ihtiyati haciz işlemlerinin de yasal dayanağı kalmadığından kaldırılması gerekir. Ancak borçlunun ödeme emrine itiraz etmemesi nedeniyle takibin kesinleşmesinden ve ihtiyati haczin kesin hacze dönüşmesinden sonra ihtiyati haciz kararı mahkemece kaldırılır ise bu durum kesinleşmiş olan takibi ve (kesin) haczi etkilemez. Yani ihtiyati haczin kaldırılmış olması nedeniyle daha önce kesin hacze dönüşmüş olan hacizlerin kaldırılmasına karar verilemez (Kuru, B. İcra ve İflas Hukuku El Kitabı, Ankara 2013, s. 1066). Takibe itiraz etmeyerek ihtiyati haczin kesin hacze dönüşmesine yol açan borçlunun aldığı ihtiyati haczin kaldırılmasına ilişkin mahkeme kararının icrasıyla icra takip dosyasında kesinlemiş hacizlerin kaldırılması takip hukuku ilkeleri ile bağdaşmaz.\nÜçüncü kişinin itirazı üzerine ihtiyati haciz kararının kaldırılması hâlinde karar tarihinde ihtiyati hacze dayalı olarak yapılan takip kesinleşip, ihtiyati haciz kesin hacze dönüşse dahi bu husus takipte taraf olmayan üçüncü kişiyi bağlamayacağı için ihtiyati haciz kararının kaldırılması ile birlikte dayanağı kalmayan hacizlerde kalkmış sayılır.\n30.07.2003 tarihinde yürürlüğe giren 4949 sayılı Kanun'la İİK'nın 265. maddesine eklenen 2. fıkra ile menfaati ihlal edilen üçüncü kişilere de ihtiyati hacze itiraz imkânı tanınmıştır. Anılan fıkranın gerekçesinde \"... Nitekim İsviçre İcra ve İflas Kanunu'nda yapılan değişiklikle üçüncü kişilere de bu olanak tanınmıştır. Zira ihtiyati haciz geçici bir hukuki koruma olup, bu karar bazen karşı taraf dinlenmeden ve ispat aranmadan verilebilmektedir. Bunun sonucu olarak borç ilişkisinin dışında kalan üçüncü kişileri de doğrudan etkileyecek tarz ve içerikte ihtiyati haciz kararı verilebilmekte, üçüncü kişilerin bu durum karşısında kendilerini açık bir hükümle koruma olanağı bulunmamaktadır. Üçüncü kişilerin ileri sürebileceği itiraz sebebinin ihtiyati haciz nedenlerine veya teminata ilişkin olabileceği belirtilmek sureti ile itiraz konusundaki tereddütlerin ortadan kaldırılması amaçlanmıştır...\" denilmektedir.\nİİK'nın 259. maddesinde üçüncü kişilerin ihtiyati haciz nedeniyle uğrayacakları zarar için tazminat davası açılması öngörülmüşken, aynı Kanun'un 265. maddesi ile 3. kişiye ihtiyati hacze itiraz hakkının tanınmasının nedeni yukarıda belirtilen hükümet gerekçesinde ayrıntılı olarak açıklanmıştır.\nBorçluya aitmiş gibi haczedilen menkullerin üçüncü kişiye ait olması söz konusu olduğunda üçüncü kişiye İİK'nın 97 ve devamı hükümlerine göre istihkak davası açma imkânı tanınmıştır. Ancak üçüncü kişinin bu hakkın varlığına rağmen, menfaati ihlal edilen üçüncü kişilere ihtiyati haciz kararına itiraz etme hakkı tanınarak istihkak davası açma yoluna başvurmaksızın ihtiyati haciz nedeniyle bir zararın doğması önlenmek istenmiştir.\nŞu hâle göre üçüncü kişinin ihtiyati hacze itiraz etmesinden sonra başlatılan takipte borçlunun takibe itiraz etmemesi nedeniyle takibin kesinleşmiş bulunmasının takip kesinleştikten sonra verilen ihtiyati haczin kaldırılması kararının icrasına bir etkisinin bulunmaması gerekir. Aksi hâlde üçüncü kişi ile arasında menfaat çatışması bulunan borçlunun takibe itiraz etmemek suretiyle üçüncü kişinin alacağı ihtiyati haciz kararının hüküm ve sonuçlarını ortadan kaldırılmasına yol açar ki bu husus İİK'nın 265. maddesinin 2. fıkrasını düzenleme amacına aykırıdır .\nSomut olayda; alacaklı Lider Faktoring Hizm. A.Ş. tarafından alınan Bursa 1. Asliye Ticaret Mahkemesi'nin 2012/1766 D. İş. sayılı ihtiyati haciz kararının infazının 29.05.2012 tarihinde icra dairesinden talep edildiği, 29.05.2012 tarihinde alacaklının takip talebinde bulunduğu, 31.05.2012 tarihinde istihkak iddiasına konu menkuller üzerine ihtiyati haciz işleminin uygulandığı, üçüncü kişinin 28.05.2012 tarihinde İİK'nın 265. maddesinin 2. fıkrası uyarınca Bursa 1. Asliye Ticaret Mahkemesinde ihtiyati haczin kaldırılması talebinde bulunduğu, ayrıca 01.06.2012 tarihinde Bursa 6. İcra (Hukuk) Mahkemesinde istihkak davası açtığı, istihkak davası derdest iken ödeme emrinin borçlu Sanikom Ulus. Paz. A.Ş.'ne 24.07.2012 tarihinde tebliğ edildiği, takibin kesinleşmesinden sonra Bursa 1. Asliye Ticaret Mahkemesinin 17.07.2013 tarihli kararı ile üçüncü kişinin açtığı dava kabul edilip 28.05.2012 tarihli ihtiyati haczin kaldırılmasına karar verildiği, kararın Yargıtay 19. Hukuk Dairesince onanarak kesinleştiği anlaşılmaktadır.\nDavacı üçüncü kişi, ihtiyati haciz kararının infazı sonrasında hem İİK'nın 99. maddesi uyarınca icra mahkemesinde istihkak davası, hem de İİK'nın 265. maddesinin 2. fıkrası uyarınca Asliye Ticaret Mahkemesinde İİK'nın 265. maddesinin 2. fıkrası uyarınca ihtiyati haczin kaldırılması davası açmıştır. Bu davanın açıldığı tarihten sonra borçlunun icra takibinde kendisine gönderilen ödeme emrine itiraz etmemesi sonucu takip ve haciz üçüncü kişi yönünden değil borçlu yönünden kesinlemiştir.\nYukarıda belirtilen ilke ve kurallar uyarınca üçüncü kişinin itirazı üzerine ihtiyati haciz kararı kaldırıldığından bu karara dayanarak yapılan ihtiyati hacizler de kalkar. Üçüncü kişinin ihtiyaten haczedilen mallarla ilgili olarak açtığı istihkak davasının konusu kalmadığından, konusu kalmayan dava hakkında karar verilmesine yer olmadığına karar verilmesi gerekir.\nHâl böyle olunca yerel mahkemenin direnme kararı uygun ve yerindedir.\nNe var ki, Özel Dairece işin esasına yönelik diğer temyiz itirazları incelenmediğinden, bu yönde inceleme yapılmak üzere dosya Özel Dairesine gönderilmelidir.\nS O N U Ç: Yukarıda açıklanan nedenlerle DİRENME KARARI UYGUN VE YERİNDE OLUP, davalı-alacaklı vekilinin işin esasına yönelik diğer temyiz itirazlarının incelenmesi için dosyanın 8. HUKUK DAİRESİNE GÖNDERİLMESİNE, 2004 sayılı İcra ve İflas Kanunu’na 5311 sayılı Kanun’un 29. maddesi ile eklenen geçici 7. maddesinin göndermesi ile uygulanması gereken İİK’nın 366/III. maddesi uyarınca kararın tebliğinden itibaren on gün içerisinde karar düzeltme yolu açık olmak üzere 30.04.2019 tarihinde oy birliği ile karar verildi.",
    "arama_kelimesi": "Hukuk",
    "scrape_tarihi": "2025-06-01T23:21:19.075191"
  },
  {
    "karar_no": 2,
    "sayfa_no": 1,
    "sira_no": "2",
    "mahkeme": "8. Hukuk Dairesi",
    "esas_no": "2009/5904",
    "karar_no_": "2010/667",
    "tarih": "11.02.2010",
    "karar_metni": "1 Hukuk Genel Kurulu 2017/1672 2019/502 30.04.2019\n\n3 Hukuk Genel Kurulu 2012/842 2013/291 27.02.2012\n\n10 Hukuk Genel Kurulu 2012/1086 2013/294 27.02.2013\n5,264,\n\n8. Hukuk Dairesi         2009/5904 E.  ,  2010/667 K.\n\"İçtihat Metni\"\nMAHKEMESİ :Asliye Hukuk Mahkemesi... ile ... ve müşterekleri aralarındaki tapu iptali ve tescil davasının reddine dair ... Asliye Hukuk Hâkimliğinden verilen 26.05.2009 gün ve 6/22 sayılı hükmün Yargıtay’ca duruşmalı olarak incelenmesi davacı vekili tarafından süresinde istenilmiş ise de; duruşma talebinin değer yönünden reddine karar verilerek, dosya incelendi, gereği düşünüldü:\nK A R A R\nDosya muhtevasına, dava evrakı ile yargılama tutanakları münderecatına ve ilâmda belirlenip dayanılan gerektirici sebeplere göre yerinde olmayan temyiz itirazlarının reddi ile usul ve kanuna uygun bulunan hükmün ONANMASINA ve aşağıda dökümü yazılı 15,60 TL peşin harcın onama harcına mahsubu ile kalan 1,55 TL’nın temyiz edenden alınmasına 11.02.2010 tarihinde oybirliğiyle karar verildi.",
    "arama_kelimesi": "Hukuk",
    "scrape_tarihi": "2025-06-01T23:21:28.226732"
  },
  {
    "karar_no": 3,
    "sayfa_no": 1,
    "sira_no": "3",
    "mahkeme": "Hukuk Genel Kurulu",
    "esas_no": "2012/842",
    "karar_no_": "2013/291",
    "tarih": "27.02.2012",
    "karar_metni": "1 Hukuk Genel Kurulu 2017/1672 2019/502 30.04.2019\n\n3 Hukuk Genel Kurulu 2012/842 2013/291 27.02.2012\n\n10 Hukuk Genel Kurulu 2012/1086 2013/294 27.02.2013\n5,264,\n\nHukuk Genel Kurulu         2012/9-842 E.  ,  2013/291 K.\nİŞÇİ ALACAĞI DAVASI\nKIDEM, İHBAR TAZMİNATI, FAZLA MESAİ ÜCRETİ, YILLIK İZİN ÜCRETİ, MAAŞ FARKI ÜCRETİ ALACAĞI İSTEMİ\nTEMYİZ SIRASINDA İBRAZ EDİLEN İBRANAMENİN İNCELENMESİ\nBORÇLAR KANUNU (818) Madde 43\n\"İçtihat Metni\"\nTaraflar arasındaki “işçi alacağı” davasından dolayı yapılan yargılama sonunda; Kadıköy 3. İş Mahkemesince davanın reddine dair verilen 17.03.2009 gün ve 2007/205 E., 2009/136  K. sayılı kararın incelenmesi davalı vekilince istenilmesi üzerine, Yargıtay 9. Hukuk Dairesinin 31.10.2011 gün ve 2009/27568 E., 2011/41842 K. sayılı ilamı ile;\n(...A) Davacının isteminin özeti:\nDavacı,  kıdem, ihbar tazminatı, fazla mesai ücreti, yıllık izin ücreti, maaş farkı ücreti alacağının ödetilmesine  karar verilmesini istemiştir.\nB) Davalının savunması:\nDavalı davacının taleplerinin yersiz olduğunu emeklilik nedeniyle  işten kendisinin ayrıldığını, Alacakları için ibraname verdiğini belirterek davanın reddini istemiştir.\nC) Yerel Mahkeme Kararının özeti;\nYerel mahkeme,isteği kısmen hüküm altına almıştır.\nD)Temyiz;\nKararı davalı Vekili temyiz etmiştir.\nE) Gerekçe\n1- Dosyadaki yazılara toplanan delillerle kararın dayandığı kanuni gerektirici sebeplere göre davalının aşağıdaki bendin kapsamı dışında kalan temyiz itirazları yerinde değildir.\n2- Davalı vekili temyiz dilekçesi ekinde ibraname örneği ibraz etmiştir.\nİbraname, ödeme def'i niteliğinde olup, her zaman ileri sürülebilir. Bu nedenle, temyiz aşamasında ibraz edilen ibraname aslı getirtilip altındaki imza ve muhtevası davacıya açıklatılıp, ödemenin varlığının belirlenmesi halinde bu miktarın davacının belirlenen alacaklarından mahsubu gerekmektedir.\n3-Kabule göre de kısmi dava dilekçesinde talep edilen alacakların faiz isteği olmamasına rağmen bu alacaklara faiz yürütülmesi ayrı bir bozma nedenidir,...)\nGerekçesiyle bozularak dosya yerine geri çevrilmekle yeniden yapılan yargılama sonunda; mahkemece önceki kararda direnilmiştir.\nTEMYİZ EDEN: Taraf vekilleri\nHUKUK GENEL KURULU KARARI\nHukuk Genel Kurulunca incelenerek direnme kararının süresinde temyiz edildiği anlaşıldıktan ve dosyadaki kâğıtlar okunduktan sonra gereği görüşüldü:\nDava, kıdem, ihbar tazminatı, fazla mesai ücreti, yıllık izin ücreti, maaş farkı ücreti alacağı istemine ilişkindir.\nDavacı vekili, davacının, davalı şirket bünyesinde 2005 yılının temmuz ayında çalışmaya başladığını, 18.6.2007 tarihinde hiçbir gerekçe gösterilmeksizin iş akdinin feshedildiğini,  iş yerinde şoför olarak çalışan davacının en son aldığı ücretin 700,00 TL  olduğunu, çalışmasının sabah 8:00-akşam 21:00-22:00 saatleri arasında olduğunu, cumartesi-Pazar çalışmanın devam ettiğini, yıllık ücretli izin  verilmediği gibi ücretlerinin de ödenmediğini, işveren tarafından 2007 yılı ocak ayından itibaren % 30 ücret artırımı yapma sözü verdiği ama zam yapılmadığını maaş farklarının da ödenmesi gerektiğini ileri sürerek 700,00 YTL kıdem tazminatı, 700,00 YTL ihbar tazminatı, 500,00 YTL fazla mesai ücreti  alacağı, 200,00 YTL, yıllık ücretli izin alacağı ve 250,00 TL maaş farkı alacağının tespiti ile davalıdan tahsiline  karar verilmesini talep ve dava etmiştir.\nDavalı E.Elektronik Cihazlar Dağıtım Nakliyat İnş. Tic. Ve San. Ltd. Şti. vekili, davacının temmuz 2005 tarihinde çalışmaya başladığı iddiasının doğru olmadığını, ilk defa 15.12.2005 tarihinde  çalışmaya başladığını, öncesinde farklı iş yerlerinde çalıştığını gösterir SSK kayıtları bulunduğunu, davalıya ait iş yerinden 18.06.2007 tarihinde ayrıldığını, son aldığı ücretin 700,00 YTL olduğu iddiasının doğru olmadığını, asgari ücret ile çalıştığını ve son ücretinin 562,50 YTL olduğunu, iş yerinden ayrılırken kıdem ve ihbar tazminatını aldığını ödemelerin makbuz karşılığı yapıldığını,  yıllık  izin ücretlerini de aldığından bu konuda alacağı bulunmadığını,  fazla çalışma iddiasının da gerçeği yansıtmadığını ileri sürerek davanın reddine karar verilmesini istemiştir.\nMahkemece; davacının yıllık izinlerini  kullandığına ilişkin imzalı izin defteri ve yazılı belge davalı tarafından dosyaya ibraz edilemediği, davacının aldığı ücrete belli dönemlerde belirli oranlarda zam yapılacağına ilişkin davalı ile aralarında düzenlenmiş yazılı hizmet sözleşmesi , toplu iş sözleşmesi veya işyeri yönetmeliğinin bulunmadığı, davacının bilirkişi raporu ile tespit edilen miktarlarda, kıdem tazminatı, fazla mesai ücreti alacağı, yıllık ücretli izin alacağı  bulunduğu, hesaplanan fazla mesai ücretinden işçinin raporlu ve izinli olduğu günler göz önünde bulundurularak Borçlar Kanunun 43. ve 44. maddesi gereğince takdiren %20 hakkaniyet indirimi yapıldığı, maaş farkı alacağının bulunmadığı gerekçesiyle maaş farkı alacağının reddi ile  ihbar tazminatı, kıdem tazminatı ve fazla mesai ücreti alacağı davasının kısmen kabulüne karar karar verilmiştir.\nÖzel Dairece, yukarıda belirtilen nedenle bozulmuştur.\nYerel Mahkemece; önceki gerekçelerle ve ayrıca davalı vekilinin  yargılamanın hiçbir aşamasında ibraname diye bir belgeden bahsetmediği, temyiz dilekçesinde belirterek ibraname belgesini ibraz ettiği, yargılama aşamasında mahkemenin haberdar olmadığı bir belge olan ibranameye dayanılarak, ibranamenin ödeme def'i olup, her zaman ileri sürülebileceği belirtilerek, bozma sebepleri dışında mahkememizin kararının bozulduğu, söz konusu ibranamenin mahkememizin kararını verdiği 17.03.2009 tarihinden çok önce 25.06.2007 tarihini taşıdığı, mahkeme kararı verildikten sonra ortaya çıkan bir ödeme def'i olmadığı, bir belgenin ödeme def'i bile olsa ileri sürülmesinin belirli bir zaman dilimi içerisinde olması gerektiği, aksi takdirde uzun yargılamalardan şikayet eden vatandaşların serzenişlerinin önüne geçilemeyeceği, yargılamanın 1,5 yıl süresi içerisinde ileri sürülmeyen bir delilin Yüksek Mahkeme tarafından temyiz dilekçesinde ekli olarak sunulması üzerine bozma sebebi yapılamayacağı, gerekçesiyle direnme kararı verilmiştir.\nMahkemenin direnmeye ilişkin kararı, taraf vekillerince temyiz edilmiştir.\nDirenme yoluyla Hukuk Genel Kurulu önüne gelen uyuşmazlık; davalı tarafından temyiz aşamasında, \"ibraname” başlıklı yeni bir belge ibraz edilmesi karşısında, bu belgenin davacı tarafından imzalanıp imzalanmadığının araştırılmasına, gerek olup olmadığı noktalarında toplanmaktadır.\nKural olarak, yargılama aşamasında dayanılıp sunulmayan deliller, temyiz veya karar düzeltme aşamasında sunulamazlar; sunulmuş olsalar bile, bu aşamalardaki incelemeler sırasında dikkate alınamazlar. Bu kuralın tek istisnası, dayanılıp sunulan delillin, o davaya konu borcu söndüren bir nitelik taşıması; örneğin, davaya konu borcun ödenmiş olduğunu gösteren makbuz, ibraname gibi bir belge olmasıdır.(Hukuk Genel Kurulu’nun 05.04.2000 gün ve 2000/11-745 E.-734 K., 28.05.2003 gün ve 2003/13-354 E.-368 K., 27.01.2010 gün ve 2009/9-586 E., 2010/31 K. sayılı Kararları).\nİbra sözleşmesi, İş Kanunu ve Borçlar Kanununda düzenlenmediği halde özellikle iş hukuku uygulamasında önemli bir yere sahiptir. Gerek öğretide ve gerekse Yargıtay uygulamasında borcu sona erdiren hallerden birisi olarak kabul edilmektedir. İbra, alacak ve borcu doğrudan doğruya ve kesin olarak ortadan kaldırmaktadır. Tam ibrada borcun tamamı, kısmi ibrada ise borcun ibra edilen kısmı sona ermektedir. Bunun sonucu olarak da, borçlu borcundan kısmen ya da tamamen kurtulmaktadır\nÖte yandan, Hukuk Muhakemeleri Kanunu’nun ( Mülga Hukuk Usulü Muhakemeleri Kanunu’nun 188.)114. maddesinde, “Hâkimin re’sen nazarı dikkate alması kanunen iktiza eden hususlar” deyimi ile dava şartlarının kastedildiği ve bu nedenle dava şartlarının mahkemece kendiliğinden gözetileceği hususu öğretide de kabul edilmektedir. (Prof. Dr. Baki Kuru; Hukuk Muhakemeleri Usulü, 2001 Bası, Cilt 2, s.1343, Prof. Dr. Saim Üstündağ; Medeni Yargılama Hukuku Cilt 1-II-İst. 1997 s.28 ve 871).  Bu noktada, dava hakkının bir anlamda dava şartı olduğu da dikkate alınmalıdır. Dava hakkının varlığı ya da yokluğunun incelenmesi, doğrudan hâkime verilmiş ödevlerden olması karşısında, Yüksek Özel Dairece, önceden ileri sürülmemiş olsa bile temyiz aşamasında dava şartının var olup olmadığını kendiliğinden gözetmesinde bir usuli engel bulunmamaktadır\nDavanın hukuksal niteliği ve somut olayın özelliği gereği davalı, temyiz aşamasında dava konusu borcu söndüren nitelikte bir belge vermişse, bu belge üzerinde gerekli inceleme yapılmak suretiyle bir karar verilmesi gerekir. Diğer bir anlatımla yargılama aşamasında, borcu itfa eden belge değerlendirilmeye alınmalıdır. Gerçekten de, yargılamada davayı inkâr eden davalının savunması borcun bulunmadığı savunmasını da kapsar. O nedenle, davalının borcun ne sebeple bulunmadığını açıklama ve iddianın aksine, delillerini ikame etme hakkının ortadan kalktığından söz edilemez.  Belirtilen nedenlerle, temyiz aşamasında sunulan ve borcu söndüren bir belgenin varlığı karşısında savunmanın genişletilmesi yasağından söz edilemeyeceğinin (HMK 140, mülga HUMK. Md. 202) kabulü zorunludur. Yargıtay Hukuk Genel Kurulu’nun 09.02.2011 gün, E:2011/13-29 K:2011/56 sayılı kararında da aynı ilke benimsenmiştir.\nSomut olayda; davalının temyiz dilekçesi ekinde ibraz ettiği, 25.06.2007  tarihli ibraname, görülmekte olan davaya konu borcu söndürebilecek bir nitelik taşımaktadır.\nHal böyle olunca; Yerel Mahkemece, Hukuk Genel Kurulu’nca da benimsenen Özel Daire bozma kararına uyularak, davalının temyiz sırasında ibraz ettiği ibranamenin incelenmesi ve sonucuna uygun bir karar verilmesi gerekirken; yanılgılı gerekçeyle önceki kararda direnilmesi usul ve yasaya aykırıdır.\nDirenme kararı bozulmalıdır.\nSONUÇ: Taraf vekillerinin temyiz itirazlarının kabulü ile, direnme kararının Özel Daire bozma kararında gösterilen nedenlerden dolayı 6217 sayılı Kanunun 30. maddesi ile 6100 sayılı Hukuk Muhakemeleri Kanunu’na eklenen “Geçici Madde 3” atfıyla uygulanmakta olan 1086 sayılı Hukuk Usulü Muhakemeleri Kanunu’nun 429. maddesi gereğince BOZULMASINA, istek halinde temyiz peşin harcının yatırana geri verilmesine,  5521 sayılı Kanunun 8/son maddesi uyarınca karar düzeltme yolu kapalı olmak üzere, 27.02.2012 oybirliğiyle karar verildi",
    "arama_kelimesi": "Hukuk",
    "scrape_tarihi": "2025-06-01T23:21:37.390600"
  },
  {
    "karar_no": 4,
    "sayfa_no": 1,
    "sira_no": "4",
    "mahkeme": "13. Hukuk Dairesi",
    "esas_no": "2019/2302",
    "karar_no_": "2019/7019",
    "tarih": "30.05.2019",
    "karar_metni": "1 Hukuk Genel Kurulu 2017/1672 2019/502 30.04.2019\n\n3 Hukuk Genel Kurulu 2012/842 2013/291 27.02.2012\n\n10 Hukuk Genel Kurulu 2012/1086 2013/294 27.02.2013\n5,264,\n\n13. Hukuk Dairesi         2019/2302 E.  ,  2019/7019 K.\n\"İçtihat Metni\"\nMAHKEMESİ :Asliye Hukuk MahkemesiTaraflar arasındaki alacak davasının yapılan yargılaması sonunda ilamda yazılı nedenlerden dolayı davanın reddine yönelik olarak verilen hükmün davacı avukatınca duruşmalı olarak temyiz edilmesi üzerine ilgililere çağrı kağıdı gönderilmişti. Belli günde duruşmalı temyiz eden davacı vekili avukatı ... ile davalı ... Bld.Bşk.lığı vekilleri avukat..., avukat ... gelmeleriyle duruşmaya başlanılmış ve hazır bulunan avukatların sözlü açıklamaları dinlenildikten sonra karar için başka güne bırakılmıştı. Bu kez temyiz dilekçesinin süresinde olduğu saptanarak dosya incelendi, gereği konuşulup düşünüldü.\nDavacı, dar gelirli ailelere konut edindirmesi kapsamında davalı belediye ile aralarında sözleşme düzenlendiğini, arsa tahsisi yapıldığını, satış bedelinin taksitler halinde ödendiğini, tahsis kararının iptal edildiğini, imar planı değişikliği ile ifanın imkansız hale geldiğini ileri sürerek; arsanın rayiç değerinin tahsiline karar verilmesini istemiştir.\nDavalı, davanın reddini dilemiştir.\nDavanın kabulüne dair verilen karar, Dairece, hükme esas alınan bilirkişi raporunun yetersizliğinden sözedilip, yeni bir rapor alınması gereğine değinilerek bozulmuş, bozmaya uyulmak suretiyle yapılan yargılama sonucu, 20.08.2016 tarihli 6745 sayılı Kanunu'nun 12. maddesiyle 775 sayılı Gecekondu Kanunu'na eklenen geçici 10.madde düzenlemesi dikkate alınarak davanın reddine karar verilmiş olup; hüküm, davacı vekili tarafından temyiz edilmiştir.\nHükme esas alınan, 20.08.2016 tarihli 6745 sayılı Kanun'un 12. maddesiyle 775 sayılı Gecekondu Kanunu'na eklenen geçici 10.madde, 05.04.2019 gün ve 30736 sayılı Resmi Gazete'de yayımlanan Anayasa Mahkemesi'nin 20.12.2018 gün, 2016/181E. ve 2018/111 K. sayılı kararı ile iptal edilmiştir. Yargılama sırasında yürürlüğe girip, yine yargılama sırasında iptal edilen kanun hükmüne dayanılarak karar verilmiş olması, hak, adalet ve nesafet kurallarına uygun düşmeyecektir. Hal böyle olunca, Daire'nin önceki bozma ilamı doğrultusunda işlem yapılmak üzere, mahkeme kararının bozulması gerekmiştir.\n2-Bozma nedenine göre, davacının sair temyiz itirazlarının incelenmesine gerek görülmemiştir.\nSONUÇ: Yukarıda 1.bentte açıklanan nedenlerle hükmün BOZULMASINA, 2.bentte açıklanan nedenle davacının sair temyiz itirazlarının incelenmesine şimdilik yer olmadığına, 2.037,00 TL duruşma avukatlık parasının davalıdan alınarak davacıya ödenmesine, peşin alınan harcın istek halinde iadesine, HUMK’nun 440/I maddesi uyarınca tebliğden itibaren 15 gün içerisinde karar düzeltme yolu açık olmak üzere, 30/05/2019 gününde oybirliğiyle karar verildi.",
    "arama_kelimesi": "Hukuk",
    "scrape_tarihi": "2025-06-01T23:21:46.530307"
  },
  {
    "karar_no": 5,
    "sayfa_no": 1,
    "sira_no": "5",
    "mahkeme": "9. Hukuk Dairesi",
    "esas_no": "2017/12632",
    "karar_no_": "2019/14923",
    "tarih": "03.07.2019",
    "karar_metni": "1 Hukuk Genel Kurulu 2017/1672 2019/502 30.04.2019\n\n3 Hukuk Genel Kurulu 2012/842 2013/291 27.02.2012\n\n10 Hukuk Genel Kurulu 2012/1086 2013/294 27.02.2013\n5,264,\n\n9. Hukuk Dairesi         2017/12632 E.  ,  2019/14923 K.\n\"İçtihat Metni\"\nMAHKEMESİ :İŞ MAHKEMESİ\nTaraflar arasında görülen dava sonucunda verilen kararın, temyizen incelenmesi davalı vekili tarafından istenilmekle, temyiz taleplerinin süresinde olduğu anlaşıldı. Dava dosyası için Tetkik Hakimi tarafından düzenlenen rapor dinlendikten sonra dosya incelendi, gereği konuşulup düşünüldü:\nYARGITAY KARARI\nDavalının, Mahkemenin 2014/469 E. 2015/840 K. ve 10/02/2016 tarihli ek kararına yönelik temyiz talebinin incelenmesi sonucunda;\nMiktar ve değeri temyiz kesinlik sınırını aşmayan taşınır mal ve alacak davalarına ilişkin nihai kararlar HUMK.nun 427/2 maddesi uyarınca temyiz edilemez.\nDavalının temyiz isteminin reddine dair Mahkemece verilen 10/02/2016 tarihli ek karara yönelik yapılan incelemede; dosya içeriğine göre temyize konu edilen miktarın 1.013,00 TL olup, karar tarihi itibariyle 2.190,00 TL' lik kesinlik sınırı kapsamında kaldığının anlaşılmasına ve buna yönelik verilen 10/02/2016 tarihli ek kararda bir isabetsizlik görülmemesine göre, davalının yerinde bulunmayan temyiz itirazlarının reddi ile usul ve kanuna uygun olan 10/02/2016 tarihli ek kararın ONANMASINA, aşağıda yazılı temyiz giderinin temyiz edene yükletilmesine, 03/07/2019 gününde oybirliği ile karar verildi.",
    "arama_kelimesi": "Hukuk",
    "scrape_tarihi": "2025-06-01T23:21:55.680634"
  },
  {
    "karar_no": 6,
    "sayfa_no": 1,
    "sira_no": "6",
    "mahkeme": "13. Hukuk Dairesi",
    "esas_no": "2016/16506",
    "karar_no_": "2019/7002",
    "tarih": "30.05.2019",
    "karar_metni": "1 Hukuk Genel Kurulu 2017/1672 2019/502 30.04.2019\n\n3 Hukuk Genel Kurulu 2012/842 2013/291 27.02.2012\n\n10 Hukuk Genel Kurulu 2012/1086 2013/294 27.02.2013\n5,264,\n\n13. Hukuk Dairesi         2016/16506 E.  ,  2019/7002 K.\n\"İçtihat Metni\"\nMAHKEMESİ :Asliye Hukuk MahkemesiTaraflar arasındaki menfi tespit davasının yapılan yargılaması sonunda ilamda yazılı nedenlerden dolayı davanın kabulüne yönelik olarak verilen hükmün süresi içinde davalı avukatınca temyiz edilmesi üzerine dosya incelendi gereği konuşulup düşünüldü.\nK A R A R\nDosyadaki yazılara, kararın dayandığı delillerle yasaya uygun gerektirici nedenlere ve özellikle delillerin takdirinde bir isabetsizlik bulunmamasına göre yerinde olmayan bütün temyiz itirazlarının reddi ile usul ve yasaya uygun olan hükmün ONANMASINA, aşağıda dökümü yazılı 1.598,43 TL. kalan harcın temyiz edenden alınmasına, HUMK’nun 440/I maddesi uyarınca tebliğden itibaren 15 gün içerisinde karar düzeltme yolu açık olmak üzere, 30/05/2019 gününde oybirliğiyle karar verildi.",
    "arama_kelimesi": "Hukuk",
    "scrape_tarihi": "2025-06-01T23:22:04.833744"
  },
  {
    "karar_no": 7,
    "sayfa_no": 1,
    "sira_no": "7",
    "mahkeme": "8. Hukuk Dairesi",
    "esas_no": "2010/968",
    "karar_no_": "2010/880",
    "tarih": "19.02.2010",
    "karar_metni": "1 Hukuk Genel Kurulu 2017/1672 2019/502 30.04.2019\n\n3 Hukuk Genel Kurulu 2012/842 2013/291 27.02.2012\n\n10 Hukuk Genel Kurulu 2012/1086 2013/294 27.02.2013\n5,264,\n\n8. Hukuk Dairesi         2010/968 E.  ,  2010/880 K.\n\"İçtihat Metni\"\nMAHKEMESİ :Sulh Hukuk MahkemesiK A R A R\nTaraflar arasındaki uyuşmazlık tapuda ölü kaydının düzeltilmesi isteğine ilişkin bulunduğuna ve davada zilyetliğe dayanılmadığına göre, 2797 sayılı Yargıtay Kanununun 14.maddesi hükmü gereğince, hükme yöneltilen temyiz itirazlarının incelenmesi Yüksek Yargıtay (14.) Hukuk Dairesine ait olmakla gereği için dosyanın anılan Daire Başkanlığına GÖNDERİLMESİNE, 19.02.2010 tarihinde oybirliğiyle karar verildi.",
    "arama_kelimesi": "Hukuk",
    "scrape_tarihi": "2025-06-01T23:22:13.969734"
  },
  {
    "karar_no": 8,
    "sayfa_no": 1,
    "sira_no": "8",
    "mahkeme": "12. Hukuk Dairesi",
    "esas_no": "2018/8839",
    "karar_no_": "2019/12006",
    "tarih": "04.07.2019",
    "karar_metni": "1 Hukuk Genel Kurulu 2017/1672 2019/502 30.04.2019\n\n3 Hukuk Genel Kurulu 2012/842 2013/291 27.02.2012\n\n10 Hukuk Genel Kurulu 2012/1086 2013/294 27.02.2013\n5,264,\n\n12. Hukuk Dairesi         2018/8839 E.  ,  2019/12006 K.\n\"İçtihat Metni\"\nMAHKEMESİ : Bölge Adliye Mahkemesi 12. Hukuk Dairesi\nYukarıda tarih ve numarası yazılı Bölge Adliye Mahkemesince verilen kararın dosyası Dairemize gönderilmiş olup, dava dosyası için düzenlenen rapor dinlendikten ve dosya içerisindeki tüm belgeler okunup incelendikten sonra işin gereği görüşülüp düşünüldü :\nTemyize konu ... 1. İcra Dairesi 2014/7743 Esas sayılı takip dosyası aslının eklenerek birlikte gönderilmesi için dosyanın mahalline GERİ ÇEVRİLMESİNE, 04.07.2019 gününde oybirliğiyle karar verildi.",
    "arama_kelimesi": "Hukuk",
    "scrape_tarihi": "2025-06-01T23:22:23.181855"
  },
  {
    "karar_no": 9,
    "sayfa_no": 1,
    "sira_no": "9",
    "mahkeme": "5. Hukuk Dairesi",
    "esas_no": "2013/24730",
    "karar_no_": "2014/131",
    "tarih": "13.01.2014",
    "karar_metni": "1 Hukuk Genel Kurulu 2017/1672 2019/502 30.04.2019\n\n3 Hukuk Genel Kurulu 2012/842 2013/291 27.02.2012\n\n10 Hukuk Genel Kurulu 2012/1086 2013/294 27.02.2013\n5,264,\n\n5. Hukuk Dairesi         2013/24730 E.  ,  2014/131 K.\n\"İçtihat Metni\"\nMAHKEMESİ :Asliye Hukuk Mahkemesi\nTaraflar arasındaki 4650 sayılı Kanunla değişik 2942 sayılı Kamulaştırma Kanununun 10. maddesine dayanan kamulaştırma bedelinin tespiti ve kamulaştırılan taşınmazın Hazine adına tescili davasından dolayı yapılan yargılama sonunda: Davanın kabulüne dair verilen yukarıda gün ve sayıları yazılı hükmün Yargıtay'ca incelenmesi, davalılardan ... vd. vekilince verilen dilekçe ile istenilmiş olmakla, dosyadaki belgeler okunup uyuşmazlık anlaşıldıktan sonra gereği görüşülüp düşünüldü.\n-K A R A R-\nMahkemece, uyulan bozma kararı gereğince inceleme ve işlem yapılarak hüküm kurulmuş; karar, davalılardan ... vd. vekili tarafından temyiz edilmiştir.\nArazi niteliğindeki taşınmazın net geliri üzerinden bilimsel yolla değerinin tespit edilmesinde; üzerinde bulunan binalara resmi birim fiyatları esas alınıp, yıpranma payı düşülerek ve ağaçlara ise yaş, cins ve verim durumlarına göre değer biçilmesinde bir isabetsizlik görülmemiştir .Ancak;\n1) Terkin yönünden eski hükmün kesin olduğundan bahisle yeniden karar verilmesine yer olmadığına hükmedilmesi doğru olmadığı gibi;\n2) 2942 sayılı Kamulaştırma Kanununun 10. maddesine 6459 sayılı Yasanın 6. maddesi ile eklenen hüküm uyarınca, dava dört ay içerisinde sonuçlandırılamadığından, Anayasa Mahkemesi’nin 19.12.2013 tarih ve 2013/817 başvuru numaralı 1. bölüm kararı da göz önüne alınarak, kamulaştırma bedeline 02.11.2010 tarihinden, karar tarihine kadar geçen süre için yasal faiz yürütülmesi gerektiğinden,\na)Gerekçeli kararın hüküm fıkrasının 3. parağrafının tümüyle çıkartılmasına yerine (... ili .. ilçesi .... Köyü 1086 parsel sayılı taşınmazın, tapu kaydının iptali ile Kadastro Kanunun 16/ C maddesi uyarınca tapudan terkinine,) ibaresinin yazılmasına,\nb)Gerekçeli kararın hüküm fıkrasının 5. parağrafının tümüyle çıkartılmasına yerine,(dava konusu taşınmaz için belirlenen 106.113,95-TL kamulaştırma bedeline 02.11.2010 tarihinden ilk karar tarihi olan 27.10.2011 tarihine kadar, bozma sonrası oluşan, bakiye 743,75 TL'ye ise 02.11.2010 tarihinden son karar tarihi olan 27.05.2013 tarihine, kadar yasal faiz işletilmesine) ibaresinin yazılmasına,\nHükmün böylece DÜZELTİLEREK ONANMASINA, peşin alınan temyiz harcının istenildiğinde iadesine ve temyize başvurma harcının Hazineye irad kaydedilmesine, 13.01.2014 gününde oybirliğiyle karar verildi.",
    "arama_kelimesi": "Hukuk",
    "scrape_tarihi": "2025-06-01T23:22:32.330863"
  },
  {
    "karar_no": 10,
    "sayfa_no": 1,
    "sira_no": "10",
    "mahkeme": "Hukuk Genel Kurulu",
    "esas_no": "2012/1086",
    "karar_no_": "2013/294",
    "tarih": "27.02.2013",
    "karar_metni": "1 Hukuk Genel Kurulu 2017/1672 2019/502 30.04.2019\n\n3 Hukuk Genel Kurulu 2012/842 2013/291 27.02.2012\n\n10 Hukuk Genel Kurulu 2012/1086 2013/294 27.02.2013\n5,264,",
    "arama_kelimesi": "Hukuk",
    "scrape_tarihi": "2025-06-01T23:22:44.677327"
  }
]
